tweet_id,timestamp,source,text,expanded_urls,rating_numerator,rating_denominator,name,retweet_count,favorite_count,dog_stage
6.77335E+17,2015-12-17 03:48:51+00:00,"<a href=""http://twitter.com/download/iphone"" rel=""nofollow"">Twitter for iPhone</a>",This dog gave up mid jump. 9/10 https://t.co/KmMv3Y2zI8,"https://twitter.com/dog_rates/status/677334615166730240/photo/1,https://twitter.com/dog_rates/status/677334615166730240/photo/1",9,10,,328,1477,
6.77332E+17,2015-12-17 03:36:28+00:00,"<a href=""http://twitter.com/download/iphone"" rel=""nofollow"">Twitter for iPhone</a>",Meet Humphrey. He's a Northern Polyp Viagra. One ear works. Face stuck like that. Always surprised. 9/10 petable af https://t.co/FS7eJQM2F4,https://twitter.com/dog_rates/status/677331501395156992/photo/1,9,10,Humphrey,265,1189,
6.77329E+17,2015-12-17 03:26:04+00:00,"<a href=""http://twitter.com/download/iphone"" rel=""nofollow"">Twitter for iPhone</a>",This is Derek. All the dogs adore Derek. He's a great guy. 10/10 really solid pup https://t.co/KgcsGNb61s,https://twitter.com/dog_rates/status/677328882937298944/photo/1,10,10,Derek,1693,3938,
6.77315E+17,2015-12-17 02:30:09+00:00,"<a href=""http://twitter.com/download/iphone"" rel=""nofollow"">Twitter for iPhone</a>","Meet Tassy &amp; Bee. Tassy is pretty chill, but Bee is convinced the Ruffles are haunted. 10/10 &amp; 11/10 respectively https://t.co/fgORpmTN9C","https://twitter.com/dog_rates/status/677314812125323265/photo/1,https://twitter.com/dog_rates/status/677314812125323265/photo/1",10,10,Tassy,611,1799,
6.77301E+17,2015-12-17 01:35:24+00:00,"<a href=""http://twitter.com/download/iphone"" rel=""nofollow"">Twitter for iPhone</a>",This is Juckson. He's totally on his way to a nascar race. 5/10 for Juckson https://t.co/IoLRvF0Kak,https://twitter.com/dog_rates/status/677301033169788928/photo/1,5,10,Juckson,471,1362,
6.77269E+17,2015-12-16 23:29:14+00:00,"<a href=""http://twitter.com/download/iphone"" rel=""nofollow"">Twitter for iPhone</a>",This is the happiest pupper I've ever seen. 10/10 would trade lives with https://t.co/ep8ATEJwRb,https://twitter.com/dog_rates/status/677269281705472000/photo/1,10,10,,790,2164,pupper
6.77229E+17,2015-12-16 20:48:40+00:00,"<a href=""http://twitter.com/download/iphone"" rel=""nofollow"">Twitter for iPhone</a>",Say hello to Chuq. He just wants to fit in. 11/10 https://t.co/hGkMCjZzn4,https://twitter.com/dog_rates/status/677228873407442944/photo/1,11,10,Chuq,1840,3837,
6.77187E+17,2015-12-16 18:03:28+00:00,"<a href=""http://twitter.com/download/iphone"" rel=""nofollow"">Twitter for iPhone</a>",Here we see a Byzantine Rigatoni. Very aerodynamic. No eyes. Actually not windy here they just look like that. 9/10 https://t.co/gzI0m6wXRo,https://twitter.com/dog_rates/status/677187300187611136/photo/1,9,10,,1033,2981,
6.76976E+17,2015-12-16 04:01:59+00:00,"<a href=""http://twitter.com/download/iphone"" rel=""nofollow"">Twitter for iPhone</a>",This is Cooper. He doesn't know how cheese works. Likes the way it feels on his face. Cheeky tongue slip. 11/10 https://t.co/j1zczS0lI5,https://twitter.com/dog_rates/status/676975532580409345/photo/1,11,10,Cooper,1203,3015,
6.76958E+17,2015-12-16 02:51:45+00:00,"<a href=""http://twitter.com/download/iphone"" rel=""nofollow"">Twitter for iPhone</a>",10/10 I'd follow this dog into battle no questions asked https://t.co/ngTNXYQF0L,https://twitter.com/dog_rates/status/676957860086095872/video/1,10,10,,907,2395,
6.7695E+17,2015-12-16 02:19:04+00:00,"<a href=""http://twitter.com/download/iphone"" rel=""nofollow"">Twitter for iPhone</a>",This is Tyrus. He's a Speckled Centennial Ticonderoga. Terrified of floating red ball. Nifty bandana. 8/10 v petable https://t.co/HqM3YhCaaa,https://twitter.com/dog_rates/status/676949632774234114/photo/1,8,10,Tyrus,448,1413,
6.76948E+17,2015-12-16 02:13:31+00:00,"<a href=""http://twitter.com/download/iphone"" rel=""nofollow"">Twitter for iPhone</a>",This is Karl. Karl thinks he's slick. 6/10 sneaky pup https://t.co/Lo4ALwjVh4,https://twitter.com/dog_rates/status/676948236477857792/photo/1,6,10,Karl,980,2354,
6.76947E+17,2015-12-16 02:08:04+00:00,"<a href=""http://twitter.com/download/iphone"" rel=""nofollow"">Twitter for iPhone</a>",This pups goal was to get all four feet as close to each other as possible. Valiant effort 12/10 https://t.co/2mXALbgBTV,https://twitter.com/dog_rates/status/676946864479084545/photo/1,12,10,,426,1844,
6.76942E+17,2015-12-16 01:50:26+00:00,"<a href=""http://twitter.com/download/iphone"" rel=""nofollow"">Twitter for iPhone</a>",Who leaves the last cupcake just sitting there? 9/10 https://t.co/PWMqAoEx2a,https://twitter.com/dog_rates/status/676942428000112642/photo/1,9,10,,855,2261,
6.76937E+17,2015-12-16 01:27:03+00:00,"<a href=""http://twitter.com/download/iphone"" rel=""nofollow"">Twitter for iPhone</a>",Here we see a rare pouched pupper. Ample storage space. Looks alert. Jumps at random. Kicked open that door. 8/10 https://t.co/mqvaxleHRz,https://twitter.com/dog_rates/status/676936541936185344/photo/1,8,10,,5515,13809,pupper
6.76898E+17,2015-12-15 22:52:02+00:00,"<a href=""http://twitter.com/download/iphone"" rel=""nofollow"">Twitter for iPhone</a>",Exotic handheld dog here. Appears unathletic. Feet look deadly. Can be thrown a great distance. 5/10 might pet idk https://t.co/Avq4awulqk,https://twitter.com/dog_rates/status/676897532954456065/photo/1,5,10,,817,2426,
6.76865E+17,2015-12-15 20:40:47+00:00,"<a href=""http://twitter.com/download/iphone"" rel=""nofollow"">Twitter for iPhone</a>",Meet Ash. He's just a head now. Lost his body during the Third Crusade. Still in good spirits. 10/10 would pet well https://t.co/NJj2uP0atK,https://twitter.com/dog_rates/status/676864501615042560/photo/1,10,10,Ash,808,2294,
6.76822E+17,2015-12-15 17:51:44+00:00,"<a href=""http://twitter.com/download/iphone"" rel=""nofollow"">Twitter for iPhone</a>",Finally some constructive political change in this country. 11/10 https://t.co/mvQaETHVSb,"https://twitter.com/dog_rates/status/676821958043033607/photo/1,https://twitter.com/dog_rates/status/676821958043033607/photo/1",11,10,,17605,25124,
6.7682E+17,2015-12-15 17:42:34+00:00,"<a href=""http://twitter.com/download/iphone"" rel=""nofollow"">Twitter for iPhone</a>",Watch out Airbud. This pupper is also good at the sports. 12/10 I'm thinking D1 https://t.co/1HrFdo7M0C,"https://twitter.com/dog_rates/status/676819651066732545/photo/1,https://twitter.com/dog_rates/status/676819651066732545/photo/1",12,10,,741,1957,pupper
6.76812E+17,2015-12-15 17:11:09+00:00,"<a href=""http://twitter.com/download/iphone"" rel=""nofollow"">Twitter for iPhone</a>",Say hello to Penny &amp; Gizmo. They are practicing their caroling. The ambition in the room is tangible. 9/10 for both https://t.co/aqBHjjh5VD,https://twitter.com/dog_rates/status/676811746707918848/photo/1,9,10,Penny,469,1536,
6.76776E+17,2015-12-15 14:50:49+00:00,"<a href=""http://twitter.com/download/iphone"" rel=""nofollow"">Twitter for iPhone</a>","When someone yells ""cops!"" at a party and you gotta get your drunk friend out of there. 10/10 https://t.co/4rMZi5Ca1k",https://twitter.com/dog_rates/status/676776431406465024/video/1,10,10,,2249,5405,
6.76618E+17,2015-12-15 04:19:18+00:00,"<a href=""http://twitter.com/download/iphone"" rel=""nofollow"">Twitter for iPhone</a>",I promise this wasn't meant to be a cuteness overload account but ermergerd look at this cozy pupper. 13/10 https://t.co/mpQl2rJjDh,https://twitter.com/dog_rates/status/676617503762681856/photo/1,13,10,,1108,3149,pupper
6.76614E+17,2015-12-15 04:05:01+00:00,"<a href=""http://twitter.com/download/iphone"" rel=""nofollow"">Twitter for iPhone</a>",This is the saddest/sweetest/best picture I've been sent. 12/10 ðŸ˜¢ðŸ¶ https://t.co/vQ2Lw1BLBF,https://twitter.com/dog_rates/status/676613908052996102/photo/1,12,10,,219,1183,
6.76607E+17,2015-12-15 03:36:42+00:00,"<a href=""http://twitter.com/download/iphone"" rel=""nofollow"">Twitter for iPhone</a>",*screeches for a sec and then faints* 12/10 https://t.co/N5QL4ySBEx,https://twitter.com/dog_rates/status/676606785097199616/photo/1,12,10,,490,2039,
6.76603E+17,2015-12-15 03:23:14+00:00,"<a href=""http://twitter.com/download/iphone"" rel=""nofollow"">Twitter for iPhone</a>",This is Godzilla pupper. He had a ruff childhood &amp; now deflects that pain outward by terrorizing cities. Tragic 9/10 https://t.co/g1tLGkyaxr,https://twitter.com/dog_rates/status/676603393314578432/photo/1,9,10,Godzilla,440,1280,pupper
6.76588E+17,2015-12-15 02:23:26+00:00,"<a href=""http://twitter.com/download/iphone"" rel=""nofollow"">Twitter for iPhone</a>",This is Bubbles. He kinda resembles a fish. Always makes eye contact with u no matter what. Sneaky tongue slip. 5/10 https://t.co/Nrhvc5tLFT,https://twitter.com/dog_rates/status/676588346097852417/photo/1,5,10,Bubbles,896,2533,
6.76583E+17,2015-12-15 02:02:01+00:00,"<a href=""http://twitter.com/download/iphone"" rel=""nofollow"">Twitter for iPhone</a>","Meet Vinnie. He's having fun while being safe. Well not a lot of fun, but definitely safe, and that's important 8/10 https://t.co/vZYtynZZlH",https://twitter.com/dog_rates/status/676582956622721024/photo/1,8,10,Vinnie,312,1310,
6.76576E+17,2015-12-15 01:32:24+00:00,"<a href=""http://twitter.com/download/iphone"" rel=""nofollow"">Twitter for iPhone</a>",This pupper is very passionate about Christmas. Wanted to give the tree a hug. So cute. 8/10 https://t.co/NsGyECJuq7,https://twitter.com/dog_rates/status/676575501977128964/photo/1,8,10,,1254,2807,pupper
6.76534E+17,2015-12-14 22:46:41+00:00,"<a href=""http://twitter.com/download/iphone"" rel=""nofollow"">Twitter for iPhone</a>",ITSOFLUFFAYYYYY 12/10 https://t.co/bfw13CnuuZ,https://twitter.com/dog_rates/status/676533798876651520/photo/1,12,10,,621,2025,
6.76496E+17,2015-12-14 20:17:59+00:00,"<a href=""http://twitter.com/download/iphone"" rel=""nofollow"">Twitter for iPhone</a>",Say hello to Griffin. He's upset because his costume for Halloween didn't arrive until today. 9/10 cheer up pup https://t.co/eoBCjSFajX,https://twitter.com/dog_rates/status/676496375194980353/photo/1,9,10,Griffin,602,1641,
6.76471E+17,2015-12-14 18:35:43+00:00,"<a href=""http://twitter.com/download/iphone"" rel=""nofollow"">Twitter for iPhone</a>",Three generations of pupper. 11/10 for all https://t.co/tAmQYvzrau,https://twitter.com/dog_rates/status/676470639084101634/photo/1,11,10,,5224,12616,pupper
6.7644E+17,2015-12-14 16:34:00+00:00,"<a href=""http://twitter.com/download/iphone"" rel=""nofollow"">Twitter for iPhone</a>",Hope your Monday isn't too awful. Here's two baseball puppers. 11/10 for each https://t.co/dB0H9hdZai,"https://twitter.com/dog_rates/status/676440007570247681/photo/1,https://twitter.com/dog_rates/status/676440007570247681/photo/1",11,10,,748,1863,
6.76431E+17,2015-12-14 15:57:56+00:00,"<a href=""http://twitter.com/download/iphone"" rel=""nofollow"">Twitter for iPhone</a>","Meet Duke. He's an Urban Parmesan. They know he's scared of the green rubber dog. ""Why u do dis?"" thinks Duke. 10/10 https://t.co/3bim9U5Idr",https://twitter.com/dog_rates/status/676430933382295552/photo/1,10,10,Duke,385,1526,
6.76264E+17,2015-12-14 04:52:55+00:00,"<a href=""http://twitter.com/download/iphone"" rel=""nofollow"">Twitter for iPhone</a>",All this pupper wanted to do was go skiing. No one told him about the El NiÃ±o. Poor pupper. 10/10 maybe next year https://t.co/fTgbq1UBR9,https://twitter.com/dog_rates/status/676263575653122048/photo/1,10,10,,609,2243,pupper
6.76237E+17,2015-12-14 03:08:46+00:00,"<a href=""http://twitter.com/download/iphone"" rel=""nofollow"">Twitter for iPhone</a>",Say hello to Winston. He has no respect for the system. Much rebellion. I think that's a palm tree... nice. 8/10 https://t.co/dOLQddhXLZ,https://twitter.com/dog_rates/status/676237365392908289/photo/1,8,10,Winston,331,1335,
6.7622E+17,2015-12-14 01:58:31+00:00,"<a href=""http://twitter.com/download/iphone"" rel=""nofollow"">Twitter for iPhone</a>",This is Kenneth. He's stuck in a bubble. 10/10 hang in there Kenneth https://t.co/uQt37xlYMJ,https://twitter.com/dog_rates/status/676219687039057920/photo/1,10,10,Kenneth,31989,67100,
6.76216E+17,2015-12-14 01:43:35+00:00,"<a href=""http://twitter.com/download/iphone"" rel=""nofollow"">Twitter for iPhone</a>",This is Herm. He just wants to be like the other dogs. Sneaky tongue slip. Super fuzzy. 9/10 would cuddle firmly https://t.co/tg8h9lzCHv,https://twitter.com/dog_rates/status/676215927814406144/photo/1,9,10,Herm,661,1881,
6.76192E+17,2015-12-14 00:07:50+00:00,"<a href=""http://twitter.com/download/iphone"" rel=""nofollow"">Twitter for iPhone</a>",These two pups just met and have instantly bonded. Spectacular scene. Mesmerizing af. 10/10 and 7/10 for blue dog https://t.co/gwryaJO4tC,"https://twitter.com/dog_rates/status/676191832485810177/photo/1,https://twitter.com/dog_rates/status/676191832485810177/photo/1,https://twitter.com/dog_rates/status/676191832485810177/photo/1",10,10,,1145,2478,
6.76146E+17,2015-12-13 21:07:04+00:00,"<a href=""http://twitter.com/download/iphone"" rel=""nofollow"">Twitter for iPhone</a>",This is Bert. He likes flowers. 10/10 https://t.co/lmQRrNxaQu,https://twitter.com/dog_rates/status/676146341966438401/photo/1,10,10,Bert,744,2077,
6.76102E+17,2015-12-13 18:10:33+00:00,"<a href=""http://twitter.com/download/iphone"" rel=""nofollow"">Twitter for iPhone</a>",Meet Striker. He's ready for Christmas. 11/10 https://t.co/B3xxSLjQSH,https://twitter.com/dog_rates/status/676101918813499392/photo/1,11,10,Striker,1284,3042,
6.76099E+17,2015-12-13 17:57:57+00:00,"<a href=""http://twitter.com/download/iphone"" rel=""nofollow"">Twitter for iPhone</a>",Extremely rare pup here. Very religious. Always praying. Too many legs. Not overwhelmingly fluffy. Won't bark. 3/10 https://t.co/REyE5YKVBb,https://twitter.com/dog_rates/status/676098748976615425/photo/1,3,10,,1623,3279,
6.76089E+17,2015-12-13 17:21:08+00:00,"<a href=""http://twitter.com/download/iphone"" rel=""nofollow"">Twitter for iPhone</a>","""Yes hello I'ma just snag this here toasted bagel real quick. carry on."" 9/10 https://t.co/Cuz0Osnekp",https://twitter.com/dog_rates/status/676089483918516224/photo/1,9,10,,483,1431,
6.75898E+17,2015-12-13 04:40:46+00:00,"<a href=""http://twitter.com/download/iphone"" rel=""nofollow"">Twitter for iPhone</a>",I'm sure you've all seen this pupper. Not prepared at all for the flying disc of terror. 10/10 https://t.co/G0pQiFGM7O,https://twitter.com/dog_rates/status/675898130735476737/photo/1,10,10,,653,1774,pupper
6.75892E+17,2015-12-13 04:14:39+00:00,"<a href=""http://twitter.com/download/iphone"" rel=""nofollow"">Twitter for iPhone</a>",This is Donny. He's summoning the demon monster Babadook. 6/10 Donny please no that won't be a good time for anyone https://t.co/kiW6Knb7Gp,https://twitter.com/dog_rates/status/675891555769696257/photo/1,6,10,Donny,976,2297,
6.75888E+17,2015-12-13 04:02:03+00:00,"<a href=""http://twitter.com/download/iphone"" rel=""nofollow"">Twitter for iPhone</a>",Breathtaking scene. A father taking care of his newborn pup. Tugs at the heartstrings. 10/10 restores my faith https://t.co/06oZdehGEa,https://twitter.com/dog_rates/status/675888385639251968/photo/1,10,10,,1067,2581,
6.75878E+17,2015-12-13 03:21:34+00:00,"<a href=""http://twitter.com/download/iphone"" rel=""nofollow"">Twitter for iPhone</a>","Ok, I'll admit this is a pretty adorable bunny hopping towards the ocean but please only send in dogs... 11/10 https://t.co/sfsVCGIipI",https://twitter.com/dog_rates/status/675878199931371520/photo/1,11,10,,1570,4531,
6.75853E+17,2015-12-13 01:41:41+00:00,"<a href=""http://twitter.com/download/iphone"" rel=""nofollow"">Twitter for iPhone</a>",Here we have an entire platoon of puppers. Total score: 88/80 would pet all at once https://t.co/y93p6FLvVw,"https://twitter.com/dog_rates/status/675853064436391936/photo/1,https://twitter.com/dog_rates/status/675853064436391936/photo/1",11,10,,1460,2927,
6.75846E+17,2015-12-13 01:12:15+00:00,"<a href=""http://twitter.com/download/iphone"" rel=""nofollow"">Twitter for iPhone</a>","This is Pepper. She's not fully comfortable riding her imaginary bike yet. 10/10 don't worry pupper, it gets easier https://t.co/40dj4eTsXG",https://twitter.com/dog_rates/status/675845657354215424/photo/1,10,10,Pepper,1000,2477,pupper
6.75823E+17,2015-12-12 23:41:18+00:00,"<a href=""http://twitter.com/download/iphone"" rel=""nofollow"">Twitter for iPhone</a>",ðŸŽ¶ HELLO FROM THE OTHER SIIIIIIIIDE ðŸŽ¶ 10/10s https://t.co/GK2HJtkdQk,https://twitter.com/dog_rates/status/675822767435051008/photo/1,10,10,,591,1652,
6.75821E+17,2015-12-12 23:34:00+00:00,"<a href=""http://twitter.com/download/iphone"" rel=""nofollow"">Twitter for iPhone</a>",Here's a handful of sleepy puppers. All look unaware of their surroundings. Lousy guard dogs. Still cute tho 11/10s https://t.co/lyXX3v5j4s,https://twitter.com/dog_rates/status/675820929667219457/photo/1,11,10,,260,1140,
6.75798E+17,2015-12-12 22:04:39+00:00,"<a href=""http://twitter.com/download/iphone"" rel=""nofollow"">Twitter for iPhone</a>",This is Bernie. He just touched a boob for the first time. 10/10 https://t.co/whQKMygnK6,https://twitter.com/dog_rates/status/675798442703122432/photo/1,10,10,Bernie,3787,11101,
6.75782E+17,2015-12-12 20:57:34+00:00,"<a href=""http://twitter.com/download/iphone"" rel=""nofollow"">Twitter for iPhone</a>",Say hello to Buddah. He was Waldo for Halloween. 11/10 https://t.co/DVAqAnb624,https://twitter.com/dog_rates/status/675781562965868544/photo/1,11,10,Buddah,537,1750,
6.7574E+17,2015-12-12 18:13:51+00:00,"<a href=""http://twitter.com/download/iphone"" rel=""nofollow"">Twitter for iPhone</a>",Here's a pupper licking in slow motion. 12/10 please enjoy https://t.co/AUJi8ujxw9,https://twitter.com/dog_rates/status/675740360753160193/video/1,12,10,,388,1257,pupper
6.75711E+17,2015-12-12 16:16:45+00:00,"<a href=""http://twitter.com/download/iphone"" rel=""nofollow"">Twitter for iPhone</a>",This is Lenny. He was just told that he couldn't explore the fish tank. 12/10 smh all that work for nothing https://t.co/JWi6YrpiO1,"https://twitter.com/dog_rates/status/675710890956750848/photo/1,https://twitter.com/dog_rates/status/675710890956750848/photo/1",12,10,Lenny,928,2046,
6.75707E+17,2015-12-12 15:59:51+00:00,"<a href=""http://twitter.com/download/iphone"" rel=""nofollow"">Twitter for iPhone</a>",This is a Sizzlin Menorah spaniel from Brooklyn named Wylie. Lovable eyes. Chiller as hell. 10/10 and I'm out.. poof https://t.co/7E0AiJXPmI,https://twitter.com/dog_rates/status/675706639471788032/photo/1,10,10,Wylie,106,693,
6.75534E+17,2015-12-12 04:35:48+00:00,"<a href=""http://twitter.com/download/iphone"" rel=""nofollow"">Twitter for iPhone</a>",Seriously guys?! Only send in dogs. I only rate dogs. This is a baby black bear... 11/10 https://t.co/H7kpabTfLj,https://twitter.com/dog_rates/status/675534494439489536/photo/1,11,10,,470,1953,
6.75531E+17,2015-12-12 04:23:49+00:00,"<a href=""http://twitter.com/download/iphone"" rel=""nofollow"">Twitter for iPhone</a>",This is Ellie AKA Queen Slayer of the Orbs. Very self-motivated. Great yard. Rad foliage. 10/10 would pet diligently https://t.co/c9jmg3Xtzn,https://twitter.com/dog_rates/status/675531475945709568/photo/1,10,10,Ellie,428,1276,
6.75522E+17,2015-12-12 03:47:46+00:00,"<a href=""http://twitter.com/download/iphone"" rel=""nofollow"">Twitter for iPhone</a>",Meet Sammy. He's a Motorola Firefox. Hat under hoodie (must be a half-decent up and coming white rapper) 10/10 https://t.co/rO2zxf0OQ0,https://twitter.com/dog_rates/status/675522403582218240/photo/1,10,10,Sammy,316,1122,
6.75518E+17,2015-12-12 03:29:35+00:00,"<a href=""http://twitter.com/download/iphone"" rel=""nofollow"">Twitter for iPhone</a>",12/10 stay woke https://t.co/XDiQw4Akiw,https://twitter.com/dog_rates/status/675517828909424640/photo/1,12,10,,507,1414,
6.75501E+17,2015-12-12 02:23:01+00:00,"<a href=""http://twitter.com/download/iphone"" rel=""nofollow"">Twitter for iPhone</a>","I shall call him squishy and he shall be mine, and he shall be my squishy. 13/10 https://t.co/WId5lxNdPH",https://twitter.com/dog_rates/status/675501075957489664/photo/1,13,10,,6485,18482,
6.75497E+17,2015-12-12 02:07:14+00:00,"<a href=""http://twitter.com/download/iphone"" rel=""nofollow"">Twitter for iPhone</a>",Meet Reggie. He's going for the world record. Must concentrate. Focus up pup. 11/10 we all believe in you Reggie https://t.co/h3AWz4AzuC,https://twitter.com/dog_rates/status/675497103322386432/photo/1,11,10,Reggie,1443,3397,
6.7549E+17,2015-12-12 01:38:53+00:00,"<a href=""http://twitter.com/download/iphone"" rel=""nofollow"">Twitter for iPhone</a>",RT until we find this dog. Clearly a cool dog (front leg relaxed out window). Looks to be a superb driver. 10/10 https://t.co/MnTrKaQ8Wn,https://twitter.com/dog_rates/status/675489971617296384/photo/1,10,10,,672,1406,
6.75483E+17,2015-12-12 01:12:54+00:00,"<a href=""http://twitter.com/download/iphone"" rel=""nofollow"">Twitter for iPhone</a>",Rare shielded battle dog here. Very happy about abundance of lettuce. Painfully slow fetcher. Still petable. 5/10 https://t.co/C3tlKVq7eO,https://twitter.com/dog_rates/status/675483430902214656/photo/1,5,10,,1081,1985,
6.75433E+17,2015-12-11 21:51:30+00:00,"<a href=""http://twitter.com/download/iphone"" rel=""nofollow"">Twitter for iPhone</a>",Happy Friday. Here's some golden puppers. 12/10 for all https://t.co/wNkqAED6lG,"https://twitter.com/dog_rates/status/675432746517426176/photo/1,https://twitter.com/dog_rates/status/675432746517426176/photo/1,https://twitter.com/dog_rates/status/675432746517426176/photo/1",12,10,,627,1623,
6.75372E+17,2015-12-11 17:51:04+00:00,"<a href=""http://twitter.com/download/iphone"" rel=""nofollow"">Twitter for iPhone</a>","The tail alone is 13/10. Great dog, better owner https://t.co/IyAXinfyju",https://twitter.com/dog_rates/status/675372240448454658/photo/1,13,10,,563,1838,
6.75363E+17,2015-12-11 17:12:48+00:00,"<a href=""http://twitter.com/download/iphone"" rel=""nofollow"">Twitter for iPhone</a>",This is Daisy. She loves that shoe. Still no seat belt. Super churlish. 12/10 the dogs are killing it today https://t.co/cZlkvgRPdn,https://twitter.com/dog_rates/status/675362609739206656/photo/1,12,10,Daisy,262,1136,
6.75354E+17,2015-12-11 16:40:19+00:00,"<a href=""http://twitter.com"" rel=""nofollow"">Twitter Web Client</a>",Everyone needs to watch this. 13/10 https://t.co/Bb3xnpsWBC,https://twitter.com/dog_rates/status/675354435921575936/video/1,13,10,,18963,35178,
6.75334E+17,2015-12-11 15:19:21+00:00,"<a href=""http://twitter.com/download/iphone"" rel=""nofollow"">Twitter for iPhone</a>",Good morning here's a grass pupper. 12/10 https://t.co/2d68FmWGGs,"https://twitter.com/dog_rates/status/675334060156301312/photo/1,https://twitter.com/dog_rates/status/675334060156301312/photo/1",12,10,,1436,3007,pupper
6.75167E+17,2015-12-11 04:14:49+00:00,"<a href=""http://twitter.com/download/iphone"" rel=""nofollow"">Twitter for iPhone</a>",This is Arnold. He broke his leg saving a handicapped child from a forest fire. True hero. 10/10 inspirational dog https://t.co/bijCeHeX4C,https://twitter.com/dog_rates/status/675166823650848770/photo/1,10,10,Arnold,1795,3920,
6.75153E+17,2015-12-11 03:21:23+00:00,"<a href=""http://twitter.com/download/iphone"" rel=""nofollow"">Twitter for iPhone</a>",What kind of person sends in a picture without a dog in it? 1/10 just because that's a nice table https://t.co/RDXCfk8hK0,https://twitter.com/dog_rates/status/675153376133427200/photo/1,1,10,,2734,6072,
6.75149E+17,2015-12-11 03:05:37+00:00,"<a href=""http://twitter.com/download/iphone"" rel=""nofollow"">Twitter for iPhone</a>",holy shit 12/10 https://t.co/p6O8X93bTQ,https://twitter.com/dog_rates/status/675149409102012420/photo/1,12,10,,1878,4037,
6.75147E+17,2015-12-11 02:56:28+00:00,"<a href=""http://twitter.com/download/iphone"" rel=""nofollow"">Twitter for iPhone</a>",When you're presenting a group project and the 4th guy tells the teacher that he did all the work. 10/10 https://t.co/f50mbB4UWS,https://twitter.com/dog_rates/status/675147105808306176/photo/1,10,10,,273,1026,
6.75147E+17,2015-12-11 02:54:12+00:00,"<a href=""http://twitter.com/download/iphone"" rel=""nofollow"">Twitter for iPhone</a>",This is Coops. He's yelling at the carpet. Not very productive Coops. 7/10 https://t.co/Uz52oYnHzF,https://twitter.com/dog_rates/status/675146535592706048/photo/1,7,10,Coops,349,1300,
6.75145E+17,2015-12-11 02:49:59+00:00,"<a href=""http://twitter.com/download/iphone"" rel=""nofollow"">Twitter for iPhone</a>",What an honor. 3 dogs here. Blond one is clearly a gymnast. Other two just confused. Very nifty pups. 9/10 for all https://t.co/YDgstgIDGs,https://twitter.com/dog_rates/status/675145476954566656/photo/1,9,10,,1011,2305,
6.75135E+17,2015-12-11 02:08:58+00:00,"<a href=""http://twitter.com/download/iphone"" rel=""nofollow"">Twitter for iPhone</a>",This is Steven. He got locked outside. Damn it Steven. 5/10 nice grill tho https://t.co/zf7Sxxjfp3,https://twitter.com/dog_rates/status/675135153782571009/photo/1,5,10,Steven,542,1398,
6.75114E+17,2015-12-11 00:44:07+00:00,"<a href=""http://twitter.com/download/iphone"" rel=""nofollow"">Twitter for iPhone</a>",Meet Zuzu. He just graduated college. Astute pupper. Needs 2 leashes to contain him. Wasn't ready for the pic. 10/10 https://t.co/2H5SKmk0k7,https://twitter.com/dog_rates/status/675113801096802304/photo/1,10,10,Zuzu,877,2120,pupper
6.75112E+17,2015-12-11 00:35:44+00:00,"<a href=""http://twitter.com/download/iphone"" rel=""nofollow"">Twitter for iPhone</a>",Say hello to Oliver. He thought what was inside the pillow should be outside the pillow. Blurry since birth. 8/10 https://t.co/lFU9W31Fg9,https://twitter.com/dog_rates/status/675111688094527488/photo/1,8,10,Oliver,283,1042,
